related,headline,image,source,summary,url
NVDA,"Market streaks, Magnificent 7 dominance, gold: Market Takeaways",https://s.yimg.com/ny/api/res/1.2/CfgA7mhnW8BeIJ_jvpDU_w--/YXBwaWQ9aGlnaGxhbmRlcjt3PTEyMDA7aD02NzY-/https://s.yimg.com/os/creatr-uploaded-images/2024-12/da112c50-b99c-11ef-bbcf-922e99d10425,Yahoo,"US stocks (^DJI,^GSPC, ^IXIC) close Friday's trading session mixed. Yahoo Finance Data and Markets Reporter Jared Blikre joins Josh Lipton on Asking for a Trend to discuss his key takeaways from the trading day: strange streaks, ""Magnificent Seven"" leadership, and physical vs. digital gold. To watch more expert insights and analysis on the latest market action, check out more Asking for a Trend here. This post was written by Naomi Buchanan.",https://finnhub.io/api/news?id=3ba1b5e8a800d093d870c5cc450329826a4245b49330159e80ca8f4922309482
NVDA,Broadcom Will Benefit From Taking Nvidia And AMD's Largest Customers (Rating Upgrade),https://static.seekingalpha.com/cdn/s3/uploads/getty_images/1643360144/image_1643360144.jpg?io=getty-c-w1536,SeekingAlpha,"Broadcom's $1 trillion valuation is driven by strong earnings growth, AI segment booming, semiconductor growth, and future revenue potential. See more here.",https://finnhub.io/api/news?id=927d55129a8f3d48b12cf655cf49162e5e2dff24138bf72434fb787543edaca7
NVDA,Is Netflix due for a stock split? One asset manager weighs in,https://s.yimg.com/ny/api/res/1.2/8fDEOE0aQ1eDea0NbSynQA--/YXBwaWQ9aGlnaGxhbmRlcjt3PTEyMDA7aD02NzY-/https://s.yimg.com/os/creatr-uploaded-images/2024-12/abed2360-b997-11ef-bf5e-a8efd9b2d6cf,Yahoo,"Mahoney Asset Management CEO Ken Mahoney joined Market Domination to discuss the potential for a stock split at Netflix (NFLX). Mahoney noted that Netflix is no stranger to stock splits, having previously executed them in February 2004 and July 2015. With Netflix trading above $900, he explained, ""There's a good precedent that once a stock gets over $600... to do a split."" He pointed to Nvidia (NVDA) as a recent example, which completed a 10-for-1 stock split earlier this year and was subsequently added to the Dow Jones Industrial Average (^DJI). The CEO further highlighted that a stock split would attract more investors to Netflix shares. The current price may be ""out of reach for the average investor,"" but a split would open the stock to a broader demographic. Mahoney forecasts that Netflix could potentially opt for a 10-for-1 stock split to increase accessibility. To watch more expert insights and analysis on the latest market action, check out more Market Domination here. This post was written by Angel Smith",https://finnhub.io/api/news?id=4c2180833e33fc11624a863e0b449637e025b0fffd1ae36059395504aa1580c0
NVDA,Stock Market Today: Small Caps Fall Again As Major Indexes Close With Minor Moves (Live Coverage),,Yahoo,"Stocks pared early gains in the stock market today, and breadth turned negative by more than 2-to-1 on both exchanges.",https://finnhub.io/api/news?id=f365b891f488bb8d06960d82d3f10932ef06112563818ace75c76020314b53ac
NVDA,Cracks In Nvidia Reveal The 8 'Secrets' Of Selling. No. 2 Is Key.,,Yahoo,"As growth stocks like Nvidia test support after monster moves, keep in mind these rules for when to sell stocks.",https://finnhub.io/api/news?id=d22d95c7929d64c25dcdb9eaca1697498f67321dfdd8db4cabd33bdb1da556e9
NVDA,Think AI Is Baffling? Here’s How to Pretend You Understand Quantum Computing.,,Yahoo,"Google introduced a new quantum computing chip this week that is faster than a supercomputer by the age of the universe. It may be the next big thing, so you need at least to know a few key concepts.",https://finnhub.io/api/news?id=3f12f3494976ba3193c067676f46724ad4f4a47976d66a7d05a132f09835c685
NVDA,Find The Next Palantir Or Hot — And 'Odd' — IPO With This Tool,,Yahoo,Use the IBD Stock Screener to quickly filter through thousands of companies to find stocks that meet your criteria.,https://finnhub.io/api/news?id=3c3190754569e3d5ad8d9c9ca520233930b1bb3262a25f986013ff656861dc39
NVDA,NVIDIA or Palantir: The Best AI Investment for 2025,https://media.zenfs.com/en/zacks.com/d5ecc6aa12bbd6de2379f25697818f57,Yahoo,"This year, Palantir's shares have outperformed NVIDIA. But does this mean Palantir is a better buy than NVIDIA for the new year? Let's see -",https://finnhub.io/api/news?id=cb39c864fbfc34f59c4211d16c747b0b19401377d4d3c5257de07a6d99e4b4a4
NVDA,U.S. Prepares New AI Chip Restrictions to Close China’s Backdoor Access,,Yahoo,Washington plans rules limiting semiconductor shipments to some countries accused of supplying Beijing.,https://finnhub.io/api/news?id=62e6220cf3639d27ce786b8aba3a3a8abccb70be8bff1aadc012f02867f4f9ad
NVDA,Fee War Kicks Off for One of Wall Street’s Hottest ETF Trades,https://s.yimg.com/ny/api/res/1.2/CUBACr4TWTuQMCpEd.rnEA--/YXBwaWQ9aGlnaGxhbmRlcjt3PTEyMDA7aD04MDA-/https://media.zenfs.com/en/bloomberg_markets_842/0cf33bcc20b88930924bb1bf28235172,Yahoo,"(Bloomberg) -- Single-stock ETFs have been one of Wall Street’s hottest trades this year thanks to eye-popping returns and billions of dollars in inflows. Now, one issuer is kicking off a fee war in a bid to stand out and attract new cash. Most Read from BloombergHong Kong's Expat Party Hub Reshaped by Chinese InfluxBrace for a Nationwide Shuffle of Corporate HeadquartersHow California Sees the World, and ItselfCity Hall Is HiringAmerican Institute of Architects CEO ResignsLeverage Shares, which",https://finnhub.io/api/news?id=37c3e23d41de474fb135956fa03f94f4a590e9712d5d336ef81efbd68d35da6c
NVDA,Is NVIDIA Corporation (NVDA) the Best Computer Hardware Stock to Invest in Right Now?,https://s.yimg.com/ny/api/res/1.2/NfbjJPIgqd_0YCYK755S9w--/YXBwaWQ9aGlnaGxhbmRlcjt3PTEyMDA7aD04MDA-/https://media.zenfs.com/en/insidermonkey.com/b85dc10e32a47d236e1aed1c1a4d607e,Yahoo,"We recently compiled a list of the 11 Best Computer Hardware Stocks to Invest in Right Now. In this article, we are going to take a look at where NVIDIA Corporation (NASDAQ:NVDA) stands against the other computer hardware stocks. What’s Driving the Computer Hardware Industry? According to a report by Research and Markets, the international IT […]",https://finnhub.io/api/news?id=1cfd2d2dab8a6a2ce172d9af87f4306e73386d9e683b421420b6c4e8661df6bd
NVDA,"Nvidia Poised to Hit $250 Share Price by 2025, Analyst Predict",https://media.zenfs.com/en/us.finance.gurufocus/03412812937b5e844d13e61d0b389761,Yahoo,"Nvidia Eyes Major Milestone, Analysts Predict Market Value to Surpass Apple",https://finnhub.io/api/news?id=88e05727b1a96fc901a7a8589bee98496e2cfdb5c63788a612b92d181f9db2c1
NVDA,Nvidia: Putting A Question Mark Behind The 'Sell' Rating,https://static.seekingalpha.com/cdn/s3/uploads/getty_images/1167425335/image_1167425335.jpg?io=getty-c-w1536,SeekingAlpha,"Nvidia is potentially in a bubble due to inflated AI expectations, risking significant stock price declines when growth rates slow. Find out why NVDA is a Sell.",https://finnhub.io/api/news?id=3cd856525e732c2f727a6736118eeb0c4e28889e4dab0d6dad1b404281911788
NVDA,Nvidia expands China team for autonomous driving research,https://www.verdict.co.uk/wp-content/uploads/2024/12/Nvidia13Dec2024-shutterstock_2502496967.jpg,Yahoo,Nvidia has also strengthened its networking software development and after-sales service teams in the country.,https://finnhub.io/api/news?id=debcbba9aa199747457ddfab599a88cd2e6cdd3bb8c2a08a5916576f7e186361
NVDA,"In the age of Slack and Zoom, Jensen Huang still swears by email to keep tabs on every corner of Nvidia",,Yahoo,"""I’m looking to detect the weak signals. It’s easy to pick up the strong signals, but I want to intercept them when they are weak.""",https://finnhub.io/api/news?id=34945ec4039503afd16697d55a0e2b51cf9450bd6a71dae699999cd599ba23ef
NVDA,Nvidia Falters At Key Level As Chip Titan Threatens Blackwell's Moat With Two Big Wins; Is Nvidia A Buy Or Sell Now?,https://media.zenfs.com/en/ibd.com/d45c0ab47a3744daf4ea121fcaa99ef3,Yahoo,"Nvidia faltered at a key level of support early Friday after chip titan Broadcom reported results but also posed risks to Nvidia's competitive edge.  The 50-day moving average is an important level of support, and Nvidia fell below it for the first time since Sept. 12 on Tuesday  — ending a nearly three-month-long feat.  If you look back at its chart, Nvidia has not made much progress after it broke out at the buy point of 140.76 in October.",https://finnhub.io/api/news?id=56c7a45b3218d44ab06af6d1e8bbf10d9cd209b0376d30f2b28536b9262330ec
NVDA,Will Nvidia Be a $5 Trillion Company in 2025?,https://g.foolcdn.com/editorial/images/800639/watching-online-video-stream-of-their-favorite-sport-mobile-gaming.jpg,Yahoo,"Nvidia (NASDAQ: NVDA) has been one of the hottest stocks on Wall Street over the past two years and performed well enough that it's vying for the title of the world's largest company against Apple.  It currently has a $3.4 trillion market cap, well over halfway to the $5 trillion market-cap figure that's estimated by Wall Street.  Nvidia performed so well in years past that a rise to $5 trillion doesn't seem all that far away, as the stock only needs to grow by 47% to get there.",https://finnhub.io/api/news?id=db3b2d591ff1a9cc4810b2fd74b299bdf296b4bbf040de9875bbe519f8144b55
NVDA,Intel: Take A Deep Breath,https://static.seekingalpha.com/cdn/s3/uploads/getty_images/1670843479/image_1670843479.jpg?io=getty-c-w1536,SeekingAlpha,Intel has come a long way under Patrick Gelsinger's leadership - five new chip manufacturing nodes. See why we're maintaining our buy rating on INTC shares.,https://finnhub.io/api/news?id=3b74739695ba586094879043e5084a17245f4afb19b84e930fdcbaf1104bbbd0
NVDA,Broadcom rallies on forecast for booming AI chip demand,https://media.zenfs.com/en/reuters-finance.com/bbcd97caf392b878e3a123a13d617bc9,Yahoo,"The company was on track to add around $120 billion to its market value of $843 billion, based on premarket share movements, as it also forecast revenue for the first quarter above Wall Street estimates on Thursday.  Broadcom has become a go-to supplier for big technology companies looking to reduce their dependence on pricey, supply-constrained AI processors made by front-runner Nvidia by developing their own advanced custom chips.  CEO Hock Tan said on Thursday he expected the AI market to present a revenue opportunity between $60 billion and $90 billion for fiscal 2027, adding that Broadcom had won two major hyperscaler customers, which refers to large cloud firms.",https://finnhub.io/api/news?id=81b61c1aca8493d737a4406f5c47f36bd97eecf2c09f2fa7d3020c9e53eb017b
NVDA,More Of The Same And What Can't Be Ignored,https://static.seekingalpha.com/cdn/s3/uploads/getty_images/155394774/image_155394774.jpg?io=getty-c-w1536,SeekingAlpha,"More of the same and why Nasdaq 20,000 can't be ignored. MVP of Q4 is Tesla.",https://finnhub.io/api/news?id=c0d8fa2f41d68210c9e52f2f78fdcc1ff8ff9a228fc8827e260ebceb24407e1f
NVDA,Palantir vs. Nvidia: Which Stock Will Outperform in 2025?,https://g.foolcdn.com/editorial/images/800723/gettyimages-1582653488.jpg,Yahoo,"Two of the top-performing tech stocks of 2024 were Palantir (NASDAQ: PLTR) and Nvidia (NASDAQ: NVDA).  In terms of stock performance, Palantir was the clear winner in 2024, with its stock up about 325% as of this writing, compared to about a 180% gain for Nvidia.  Companies with wide moats are generally considered desirable.",https://finnhub.io/api/news?id=2f63bd615dc424226fa961b67f6f48d55bf4936cd71f4d155c292b9fb795975a
NVDA,Nvidia Stock Gains. What Broadcom Earnings Mean for the AI Chip Maker.,,Yahoo,Broadcom backed up Nvidia’s projections that large technology companies have an appetite for building data centers with up to 10 times as many AI chips as today.,https://finnhub.io/api/news?id=e4318bc54beddb6c8f43911284d5ec54a20e805c616f685230aac316140c4878
NVDA,2 Growth ETFs to Buy With $200 and Hold Forever,https://g.foolcdn.com/editorial/images/800473/gettyimages-462756183.jpg,Yahoo,"In general, there are two main types of investing: value investing and growth investing.  When it comes to exchange-traded funds (ETFs), I prefer index ETFs that focus on growth stocks.  The reasons are simple: First, index funds tend to have the lowest expenses.",https://finnhub.io/api/news?id=0d0e3833caa3e838b8f52b36ee88a963cb11df0c0d29a748f64c917e124e7e60
NVDA,Prediction: These Will Be Wall Street's 2 Most-Prominent Stock-Split Stocks of 2025,https://g.foolcdn.com/editorial/images/800659/stock-split-us-dollar-coin-certificate-forward-reverse-getty.jpg,Yahoo,"Stock-split euphoria took over Wall Street in 2024, and two brand-name companies could continue this trend in the new year.",https://finnhub.io/api/news?id=5e000a6c394a97bb9c223e645def99dbca02fcafc7366f42f894a7dada19cef6
NVDA,"Google's quantum chip, Siri gets ChatGPT, and OpenAI's video generator: AI news roundup",https://media.zenfs.com/en/quartz.com/f27f861ea7f53f6c38406fa896c2c2fe,Yahoo,"OpenAI continued its holiday event, “12 Days of OpenAI,” this week with more product launches, including its highly anticipated AI video generator, Sora. It also announced that its ChatGPT chatbot is now accessible through Apple’s voice assistant, Siri.",https://finnhub.io/api/news?id=20e5586ba5666aa4e26a0425456307e6a1a9c209af4d49af58bda75b51202222
NVDA,Is Nvidia Going to Plunge 50% (or More)? History Offers a Very Clear Answer.,https://g.foolcdn.com/editorial/images/800649/stock-chart-crash-invest-broker-tablet-crypto-plunge-bubble-getty.jpg,Yahoo,Businesses responsible for leading next-big-thing innovations have a checkered past.,https://finnhub.io/api/news?id=da4c8916bf7a33bfdc7da4b57209193f9bc38cf283be38d0c2704d68d2ee836f
NVDA,American Century Growth Fund Q3 2024 Commentary,https://static.seekingalpha.com/cdn/s3/uploads/getty_images/1400960132/image_1400960132.jpg?io=getty-c-w1536,SeekingAlpha,The broad U.S. stock market posted solid gains that saw a reversal of first-half  trends. Click here to read the full commentary. ,https://finnhub.io/api/news?id=4ff36e88373737720c7fd00f3c4e9dd534f9310a1128306049df92336f433aad
NVDA,Nvidia Stock: Would You Believe Trees Don't Grow To The Sky,https://static.seekingalpha.com/cdn/s3/uploads/getty_images/2154525209/image_2154525209.jpg?io=getty-c-w1536,SeekingAlpha,"Nvidia's recent rally is driven by data center revenue, with significant revenue concentration from three major customers, posing a risk. Learn more on NVDA stock here.",https://finnhub.io/api/news?id=c93b316073c6a46e0e09cf28ea4171cff7d7d80fd66d8459fb7aa47657079872
NVDA,1 Spectacular Artificial Intelligence (AI) ETF to Buy With $40 During the S&P 500 Bull Market,https://g.foolcdn.com/editorial/images/800503/a-digital-render-of-a-jumping-bull.jpg,Yahoo,"The S&P 500 (SNPINDEX: ^GSPC) index has been on an absolute tear over the last couple of years.  Technology stocks are leading the index higher, but those in the artificial intelligence (AI) space have generated especially powerful gains.  Nvidia stock, for example, is up by a whopping 188% this year.",https://finnhub.io/api/news?id=984c757017ae04caa98bf1e3bf0675788dc2f703bc06a56a9119bd881680fb23
NVDA,"Meet the Supercharged Artificial Intelligence (AI) Growth Stock That Could Join Apple, Nvidia, and Microsoft in the $3 Trillion Club by 2027",https://g.foolcdn.com/editorial/images/800577/a-hand-showing-a-spark-and-two-ai-icons-exchanging-information.jpg,Yahoo,This tech giant is a household name and could be among the biggest beneficiaries of AI.,https://finnhub.io/api/news?id=e68f88fe87acacdd99247286816c36d16b4708a3582c2c470ff41bf4ea749406
NVDA,"Billionaires Are Buying a Supercharged Index Fund That Includes Nvidia, Tesla, and Other ""Magnificent Seven"" Stocks",https://g.foolcdn.com/editorial/images/800725/growth-26.jpg,Yahoo,"The S&P 500 (SNPINDEX: ^GSPC) has advanced 27% year to date due to enthusiasm about artificial intelligence, and the ""Magnificent Seven"" stocks have contributed more than half of those gains.  The hedge fund billionaires listed below bought shares of the Invesco QQQ Trust (NASDAQ: QQQ) during the third quarter, a supercharged index fund that offers heavy exposure to those seven stocks.  Paul Tudor Jones of Tudor Investment purchased 98,531 shares of the Invesco QQQ Trust, opening a new position.",https://finnhub.io/api/news?id=cfee5eb0ec0440b4aee39c4868ce5c27a18ad48f02ee577bb0f49e0fde38c7c6
NVDA,American Century Focused Global Growth Fund Q3 2024 Commentary,https://static.seekingalpha.com/cdn/s3/uploads/getty_images/1487894859/image_1487894859.jpg?io=getty-c-w1536,SeekingAlpha,"Stocks rebounded from a brief early August downturn fed by fears the Fed wouldnât act quickly
enough to stave off a recession. Click here to read the full commentary. ",https://finnhub.io/api/news?id=bf92e595a5fb6ce0970e86fec96b513b51bc5402713a63583605afa1bcfd9f90
NVDA,Mizuho says Nvidia stock is set to hit $170 in Q1 2025. Here's why,https://s.yimg.com/cv/apiv2/social/images/yahoo_default_logo-1200x1200.png,Yahoo,"Jordan Klein, a tech desk sector strategist at Mizuho (NYSE:MFG), sees a bullish outlook for NVIDIA's stock, predicting that the company's management will present a very optimistic view during investor meetings at the upcoming CES in early January.",https://finnhub.io/api/news?id=b7493adcbb45c752835348e527503ed1fb6df7f6a556a1fd74aee48b292c9e7e
NVDA,American Century Focused Dynamic Growth Fund Q3 2024 Commentary,https://static.seekingalpha.com/cdn/s3/uploads/getty_images/1358927461/image_1358927461.jpg?io=getty-c-w1536,SeekingAlpha,The broad U.S. stock market posted solid gains that saw a reversal of trends from the first half of the year. Click here to read the full commentary. ,https://finnhub.io/api/news?id=de1a9e3597b99763ff340611ce4c76539e433699021b7f08351ac79069fef323
NVDA,Funds for investors to watch in 2025,https://s.yimg.com/ny/api/res/1.2/VvSFQHVPJgTSHJ4FeIPWMQ--/YXBwaWQ9aGlnaGxhbmRlcjt3PTEyMDA7aD04MDA-/https://s.yimg.com/os/creatr-uploaded-images/2024-08/ed47b060-662b-11ef-b3ff-222ed99ab9bb,Yahoo,"For investors looking to refresh their portfolio, experts highlight fund ideas to consider going into the new year.",https://finnhub.io/api/news?id=bfd2ceb5872db1716946b511c0f1b665478eb4fd480844c6a10239a98fadc880
NVDA,Why the Stock Market Could Gain Another 20% in 2025,,Yahoo,Wall Street’s market forecasts are too tepid. The S&P 500 could rally next year on a combination of AI growth and deregulation. But investors should prepare for a wilder ride.,https://finnhub.io/api/news?id=d38d010a6ed2874d2247a5939d49874a1f0b2fefe47b39a52c4ac9dbce4a232c
NVDA,Generative AI Digest: A Shift To The Application Layer,https://static.seekingalpha.com/cdn/s3/uploads/getty_images/1817371218/image_1817371218.jpg?io=getty-c-w1536,SeekingAlpha,"The recent US election results have significant implications for the AI industry, with many predicting a more lenient approach to agency regulation and antitrust enforcement.",https://finnhub.io/api/news?id=378f5779bf6b05b9a994062e68f3a4bcae50f17372dc12416a0f3ce0eb5df499
NVDA,China eyes negotiations as Trump threatens new tariffs,,Finnhub,"As Donald Trump steps up his tariff threats against China, Beijing is moving to beat the next U.S. president to the punch with its own restrictions and get Washington to the negotiating table ahead of...",https://finnhub.io/api/news?id=795914ebfdedc725a05edf57ed0800baa8cea0fbc3d44a01fe32d517df24d727
NVDA,Marvell Technology: Top Pick For AI Growth,https://static.seekingalpha.com/cdn/s3/uploads/getty_images/472592074/image_472592074.jpg?io=getty-c-w1536,SeekingAlpha,"Marvell Technology's data center growth surged in Q3'25, driven by AI demand and strategic partnerships, setting the strong foundation for eFY26. See more here.",https://finnhub.io/api/news?id=68d5d9170f630c2b61b6a6552cb538daedc8b444dda70fdec489ddcccc1f089c
NVDA,Nvidia scales international hiring for critical new tech sector,,Yahoo,The big tech leader is showing everyone that it can do.,https://finnhub.io/api/news?id=a02c0c6c5fa7449421daa22ada17853838e5accd71323e7db944fa66b6eecfd2
NVDA,Broadcom Stock Jumps on Surging AI Chip Sales. CEO Sees ‘Massive’ Opportunity.,,Yahoo,The chip company delivered an earnings beat along with a better-than-expected sales forecast for the current quarter.,https://finnhub.io/api/news?id=05893f4591003941bc665c1ae37ec602666ef1a2bb886bda690820be4df9a050
NVDA,Jim Cramer on Nvidia (NVDA): ‘It Has No Competitors’,https://media.zenfs.com/en/insidermonkey.com/dc5a2bcb6b4c16a43cb5b4ba98feb139,Yahoo,"We recently published a list of Jim Cramer’s Latest Calls: Top 10 Stocks. In this article, we are going to take a look at where NVIDIA Corporation (NASDAQ:NVDA) stands against other stocks highlighted in Jim Cramer’s latest calls. Jim Cramer in a recent program talked about Bitcoin and reminded investors that he has always believed […]",https://finnhub.io/api/news?id=b4a14d0ea317bc1fe7f6930d56f7699888ac12fd451f6a44c44a7366db88cc0c
NVDA,Nvidia Denies Supply Cut Rumors Amid Regulatory Scrutiny in China; Shares Down,https://media.zenfs.com/en/us.finance.gurufocus/7accc684e6ccea4efa8f5d1b61e564d6,Yahoo,Nvidia firmly denied rumors of reducing or halting its product supplies to China.,https://finnhub.io/api/news?id=4f8fa7681e54223cdac412dfa5df8e20465cab12b33b304111f7d73a618a1943
NVDA,Intel's CEO Was Ousted Leaving The West In Dire Need Of Foundry Fortification (Rating Downgrade),https://static.seekingalpha.com/cdn/s3/uploads/getty_images/1800440834/image_1800440834.jpg?io=getty-c-w1536,SeekingAlpha,"Examine Intel's challenges, including the resignation of its CEO and the potential sale of Intel Foundry Services. Learn more about INTC stock here.",https://finnhub.io/api/news?id=34d624ea9bf65e3b4f65a954148ba43a2f31d27d039dbfd033c399633f6bc2f6
NVDA,"Kyndryl Stock Hits 52-Week High, Boosted by Nvidia Partnership and Strategic Growth",https://s.yimg.com/ny/api/res/1.2/cL5l7qtCUeGmX3DSmDquCw--/YXBwaWQ9aGlnaGxhbmRlcjt3PTEyMDA7aD04MDA-/https://media.zenfs.com/en/us.finance.gurufocus/f87619704ac4dcd9c9f66b4a8fafba44,Yahoo,Kyndryl has expanded collaborations with Amazon Web Services and Nokia.,https://finnhub.io/api/news?id=b0653de1f8cc56c5607d99989e5b04e0c207b7b222da9858c09f2b6a401f28fb
NVDA,Double Down On Shorting Nvidia In 2025,,SeekingAlpha,,https://finnhub.io/api/news?id=555a2ba61a593bf7239d14749d934f93f0560239c4396f01c3fd84ec6386d486
NVDA,Broadcom Earnings: This Train Cannot Be Stopped,https://static.seekingalpha.com/cdn/s3/uploads/getty_images/1657921553/image_1657921553.jpg?io=getty-c-w1536,SeekingAlpha,"Learn about Broadcom Inc.'s Q4 earnings report showcasing impressive growth driven by AI revenue, leading to AVGO stock being a Buy. Click for my earnings update.",https://finnhub.io/api/news?id=126d54995fb959d9c680fbf187a86b72822358ab6142df07e1b0e6b86e5258bd
NVDA,Intel: Qualcomm Buyout Possibility Is A Real Risk For Bears And AMD,https://static.seekingalpha.com/cdn/s3/uploads/getty_images/2161767969/image_2161767969.jpg?io=getty-c-w1536,SeekingAlpha,Recent events suggest a possible Qualcomm Incorporated buyout of Intel Corporation. Click here to read an analysis of INTC stock now.,https://finnhub.io/api/news?id=4aad05aca2755cf31e03966e9eb14cb74a93c45ba60de60b9ba8f48fbf34b6cb
NVDA,Nebius: Lots Of Upside Levers,https://static.seekingalpha.com/cdn/s3/uploads/getty_images/636081272/image_636081272.jpg?io=getty-c-w1536,SeekingAlpha,"Nebius rebrands with $700m funding from Nvidia and Accel, focusing on AI cloud platforms, offering potential upside for investors. Click for more on NBIS stock.",https://finnhub.io/api/news?id=b5a980391dd3a9bf849cede38cf3eab80efc7f59fddb9db8ee349a322c08a29b
NVDA,This Stock Outperformed Nvidia. It Has Nothing to Do With Tech or AI.,,Yahoo,"Shares of Dallas-based Brinker are up 201% this year, as of Wednesday’s close, the best performance for the stock since first going public 40 years ago.  The restaurant commands a market value of $5.8 billion, over three times higher than at the start of the year.  Goldman Sachs called the stock its top idea and initiated it at Buy last week.",https://finnhub.io/api/news?id=007d171b1e8bf78dd4280c918d5418c431023510ce65bd6d79c5a5b0e5ab6d92
NVDA,"Mizuho: Modular Data Centers to Power AI Growth, Favoring Dell, Nvidia, and Key IT Players",,Yahoo,"Mizuho sees modular data centers boosting Dell, Nvidia, and others as AI's power needs drive demand.",https://finnhub.io/api/news?id=148b71b64b1f929b46cdd93931303c0c48899c3ce308bcaaa05bb0e87da0a132
NVDA,Crusoe secures $600 million in Series D round led by Founders Fund,https://s.yimg.com/cv/apiv2/social/images/yahoo_default_logo-1200x1200.png,Yahoo,"Other investors in the round included Fidelity, Long Journey Ventures, the United Arab Emirates sovereign wealth fund Mubadala, Nvidia, Ribbit Capital and Valor Equity Partners, the company said.  The latest fundraising will be used to invest in the expansion and growth of data centers and the Crusoe cloud, the startup said.",https://finnhub.io/api/news?id=ab43ecbd348034418a4d6ca4a7615c4c015859f03e2d241c3e48df2ec5b5ed4c
NVDA,Himax Soars 20% as Analyst Predicts Key Role in Nvidia and TSM's AI Revolution,https://media.zenfs.com/en/us.finance.gurufocus/2da57a1e0c2c113bf4c11e650ddcb5d2,Yahoo,Himax gains on optimism for its pivotal role in next-gen AI and high-performance semiconductor advancements.,https://finnhub.io/api/news?id=891ae941c67a53dd6da3bb9a7c15d98c0a4ebb1957b21eaa35fa07a5009c2dd5
NVDA,Nvidia Stock Falls. Microsoft’s Market Value Overtakes the Chip Maker.,,Yahoo,"Now the gold and silver belong to  Apple  and  Microsoft  respectively.  Nvidia  stock was off 1.8% at $136.85 in late morning trading.  It was the worst performer in the  today, according to Dow Jones Market Data.",https://finnhub.io/api/news?id=cc000844f0991a5a6dbf6a1cce66c33e98e8de4c2797afd446e01c0941f54fcd
