related,headline,image,source,summary,url
NVDA,"The Best Stocks to Invest $50,000 in Right Now",https://g.foolcdn.com/editorial/images/800941/gettyimages-1357572936.jpg,Yahoo,"Technology stocks have scored a major win in 2024, recording top performances in the S&P 500 and Dow Jones Industrial Average.  The biggest gainers in each were Palantir Technologies and Nvidia (NASDAQ: NVDA), respectively, thanks to the artificial intelligence (AI) boom.",https://finnhub.io/api/news?id=2f87c953edfefa6739ee3b65238fe7b56d276ed46eae6ddc024128b179691b4e
NVDA,‘The Nvidia Way’ Review: The Hard Work of Tech Mastery,https://media.zenfs.com/en/wsj.com/7b2c285183be07ca3c4e8242b25a59a8,Yahoo,"When Nvidia’s CEO is asked how to be successful, he will respond: “I wish upon you ample doses of pain and suffering.”",https://finnhub.io/api/news?id=d9caa54d6337dde83269bc7aed751cefaea58d3341d3b7925a59389f8aed4acc
NVDA,3 Market-Beating Tech Stocks to Supercharge Your Portfolio in 2025 and Beyond,https://g.foolcdn.com/editorial/images/800746/2025-investing-ideas.jpg,Yahoo,"The technology sector was a party in 2024. Thanks to their robust fundamentals and red-hot growth opportunities, these three prominent tech stocks are poised to continue the fun.",https://finnhub.io/api/news?id=fbfa9563cb09caf871b02fa45b8a4e7d522c7fbb7b04517653dd0ebcafdf8f75
NVDA,Better Artificial Intelligence Stock: IonQ vs. Nvidia,https://g.foolcdn.com/editorial/images/800484/artificial_intelligence_robot_looking_at_equations_gettyimages-966248982-1200x772-f9fd0c6.jpg,Yahoo,"Two prominent companies in this area are quantum computing company IonQ (NYSE: IONQ) and semiconductor-giant Nvidia (NASDAQ: NVDA).  Through Dec. 11, IonQ's share price was up around 140%, and Nvidia's had risen about 180% in 2024.  IonQ is an attractive investment because quantum computing can evolve AI beyond what's possible with the most powerful supercomputers on the planet.",https://finnhub.io/api/news?id=48604b8fc9c3da6aed94ecac91696465e5c963b0aae87e053031f3f48d208d6c
NVDA,"Nvidia, GM, Walmart, Palantir, Tesla, Meta, and others battle this Yahoo Finance awards season",https://s.yimg.com/ny/api/res/1.2/ru3PG08Kvp.vG7uVZ9V35g--/YXBwaWQ9aGlnaGxhbmRlcjt3PTEyMDA7aD03OTc-/https://s.yimg.com/os/creatr-uploaded-images/2024-12/f7b518b0-b98e-11ef-9dbf-2fdb63853ae1,Yahoo,Which companies really delivered the goods for investors in 2024?,https://finnhub.io/api/news?id=70d98fa280c1fdd757b348066fb97179fc9d90dfe615a451f5719928300e66a7
NVDA,Meet the Newest Artificial Intelligence (AI) Chip Stock to Join Nvidia in the $1 Trillion Club,https://g.foolcdn.com/editorial/images/801004/gettyimages-artificial-intellgence-chip.jpeg,Yahoo,This is the company making the next generation of AI chips for big tech.,https://finnhub.io/api/news?id=1e5aa6823a25aab9e170eda62d77799ef9bbfe5adf78f9217d713a0d16c57814
NVDA,Jim Cramer Says He Was Wrong on NVIDIA Holding Recursion Pharmaceuticals (RXRX),https://s.yimg.com/ny/api/res/1.2/kw15oVFT8Nw9PKshleui.Q--/YXBwaWQ9aGlnaGxhbmRlcjt3PTEyMDA7aD02NzM-/https://media.zenfs.com/en/insidermonkey.com/198a1516872a8cd09220c99d73a2f530,Yahoo,"We recently published a list of Jim Cramer’s Latest Calls: Top 10 Stocks. In this article, we are going to take a look at where Recursion Pharmaceuticals Inc (NASDAQ:RXRX) stands against other stocks highlighted in Jim Cramer’s latest calls. Jim Cramer in a recent program talked about Bitcoin and reminded investors that he has always […]",https://finnhub.io/api/news?id=70b0060cac10f10a0396d9161613977e55d23bd14ae9e2bf3d91c00cd5f2fd44
NVDA,The final Fed meeting of 2024 awaits: What to know this week,https://s.yimg.com/ny/api/res/1.2/6QPqUaTyU4VlRf8vKVSSLw--/YXBwaWQ9aGlnaGxhbmRlcjt3PTEyMDA7aD04MDA-/https://s.yimg.com/os/creatr-uploaded-images/2024-12/e7cab930-b98b-11ef-bffd-29c558d83743,Yahoo,Investors will be closely watching for any hints on how much further the Federal Reserve plans to lower interest rates in 2025.,https://finnhub.io/api/news?id=2b659a32e8b2dc92da76cf41f428202fad2848eff7d91ba72bc362994e517352
NVDA,Here Are My Top 3 Artificial Intelligence (AI) Stocks to Buy Hand Over Fist in 2025. Hint: Nvidia's Not on the List.,https://g.foolcdn.com/editorial/images/800726/gettyimages-2157571110.jpg,Yahoo,"Artificial intelligence (AI) should remain as a top opportunity for investors in 2025, but there are plenty of opportunities beyond Nvidia.",https://finnhub.io/api/news?id=8e7bffff8edf73f522dcc73ae96386dc8f17b06fd8eb0f35318c9baeba0fa59c
NVDA,"After Gaining 2,300%, Is Nvidia Stock Done?",https://g.foolcdn.com/editorial/images/800482/investor-research.jpg,Yahoo,"The past few years have witnessed an unprecedented expansion of artificial intelligence (AI) into various aspects of life.  Cashing in on this expansion, companies involved in this space are most certainly at the forefront of the next big thing in AI applications.  Of all the key players, Nvidia (NASDAQ: NVDA) has clearly been the one to watch, gaining a jaw-dropping 2,300% increase over the past five years (at the time of this writing), cementing its position as one of the most remarkable growth stories in the technology space.",https://finnhub.io/api/news?id=40fed3176928fecece23b44d568f9cf99f55ea03ebca2a933ccfcf863d9a9b58
NVDA,"Despite Recent News, Analysts Still Say Artificial Intelligence Stock Nvidia Is a Buy. Here's Why.",https://g.foolcdn.com/editorial/images/800850/gettyimages-2149530993-1200x675-128554e-1.jpg,Yahoo,"Nvidia (NASDAQ: NVDA) has been one of the best performing stocks over the past few years, a run that catapulted it into the world's most valuable company.  Many Wall Street analysts think the best is yet to come for this crucial supplier of chips to power artificial intelligence (AI).  Looking back at the company's most recent quarterly results, announced on Dec. 6, pretty much everything is going right for Nvidia now.",https://finnhub.io/api/news?id=ca8125b7ba4a2d3fd6d13b5d044123d7a0b971903db94291bd28abcbdb23c3bb
NVDA,Does This Valuation Of NVIDIA Corporation (NASDAQ:NVDA) Imply Investors Are Overpaying?,https://media.zenfs.com/en/simply_wall_st__316/dca719ac52e206a9a696149c1568653d,Yahoo,"Key Insights Using the 2 Stage Free Cash Flow to Equity, NVIDIA fair value estimate is US$101 NVIDIA's US$134 share...",https://finnhub.io/api/news?id=bbd00d10b56c656e0fce1367ee20bc2f41a629cfd76fae12f9ae62ff1a3e942a
NVDA,This Artificial Intelligence (AI) Stock Soared 217% Since Nov. 1. Should Investors Expect a Stock Split in 2025?,https://g.foolcdn.com/editorial/images/800848/gettyimages-1622583937-1200x720-06227a7.jpg,Yahoo,"In early 2024, the company secured a multimillion-dollar investment from Nvidia, the largest supplier of artificial intelligence (AI) graphics processing units (GPUs) on the planet.  Might the company enact a stock split in 2025?  Nvidia, one of the industry's main suppliers, is the second-most valuable company in the world.",https://finnhub.io/api/news?id=2aa31fd7e51a8326b0d2fa75ff47b4b4296a4e3b4dc091c20208eb21345911c3
NVDA,History Says the Nasdaq Will Soar in 2025. Here's the 1 AI Stock to Buy Before It Does.,https://g.foolcdn.com/editorial/images/800772/gettyimages-482044926.jpg,Yahoo,"The Nasdaq has blasted higher over the past two years, gaining more than 43% last year and now heading for an increase of more than 33% for 2024.  This is thanks to the artificial intelligence (AI) boom, as five of the benchmark's most heavily weighted stocks and several others in the top 10 operate in this high-growth area.  Because it could revolutionize the way many things are done, saving companies time and money -- and that's great news for earnings growth.",https://finnhub.io/api/news?id=ec841b7b76c7c222473c6bf33aaf2393b3c0a6fa17bbffd8332fbc389c6652ff
NVDA,Everyone Knows About Nvidia and Palantir. But These Other 3 Stocks Are Quietly Crushing the S&P 500 in 2024 As Well.,https://g.foolcdn.com/editorial/images/800130/mature-person-looks-optimstically-out-of-a-window.jpg,Yahoo,"There's no way to deny it: 2024 was a stunning year for the stock market.  As of this writing, the S&P 500 is up nearly 28% year to date.  As always, there are stocks significantly outperforming this otherwise impressive return.",https://finnhub.io/api/news?id=0b636b970e758df915557f100497cda317fde35e9ae3d9d02f5e368902bf2517
NVDA,"1 Stock With Monster Upside to Buy as the AI Trade Enters Its Next Phase in 2025, According to Wall Street Analysts",https://g.foolcdn.com/editorial/images/800988/artificial-intelligence-23.jpg,Yahoo,"Jim Tierney at AllianceBernstein recently told Yahoo Finance that chipmakers like Nvidia were the first phase of the artificial intelligence (AI) trade.  Numerous companies should benefit as the trend takes shape, but Cloudflare (NYSE: NET) is one investors may overlook because it receives less media coverage than the ""Magnificent Seven"" companies.  Here's what investors should know about this cloud infrastructure stock.",https://finnhub.io/api/news?id=fe61928afeef9c942f9d643e7745252b94227f7602376ee1f2d6da5456b5f82d
NVDA,These Are the 5 Top-Performing Stocks in the Nasdaq-100 With 2024 Almost Over,https://g.foolcdn.com/editorial/images/800987/a-person-cheering-while-looking-at-graphs-on-a-computer-monitor.jpg,Yahoo,Which stocks have driven the Nasdaq-100 higher in 2024? This eclectic collection of market leaders is dazzling investors.,https://finnhub.io/api/news?id=085ca74a9c8405d1bcd6aede29615c1151e14b7511ee04d3f415a4154c33c31c
NVDA,"Meet the 3 Supercharged Growth Stocks Poised to Hit $4 Trillion by 2025, According to a Certain Wall Street Analyst",https://g.foolcdn.com/editorial/images/800832/person-looking-at-computer-monitor-cheering-because-the-stock-market-went-up.jpg,Yahoo,The race is on to be the first company with a $4 trillion market cap. One Wall Street analyst believes investors should look at the big picture.,https://finnhub.io/api/news?id=6cc48320dbcf4ae8a090d364e6c3c66a2badda8b0dbfd1b232511b2eb8acc6b2
NVDA,"Blackwell May Be Nvidia's Hottest Ticket in 2025, but This Other Opportunity Could Be Even Bigger in the Long Run",https://g.foolcdn.com/editorial/images/800709/gettyimages-2078917109.jpg,Yahoo,"Over the last two years, semiconductor designer Nvidia (NASDAQ: NVDA) has become a household name thanks to its lead position in the artificial intelligence (AI) revolution.  Nvidia's deep roster of GPUs has been the biggest spark for the company's rapid ascent to being one of the world's most valuable businesses.  This newfound growth helped Nvidia generate billions in profits and free cash flow on a consistent basis over the last several quarters.",https://finnhub.io/api/news?id=a0c0048c097d083ec94a7051682c4393fd5204f7582fb06821997d22bc4d16c7
NVDA,Pioneer Mid Cap Value Fund Q3 2024 Performance And Market Commentary,https://static.seekingalpha.com/cdn/s3/uploads/getty_images/1421629295/image_1421629295.jpg?io=getty-c-w1536,SeekingAlpha,"For the third quarter, mid-cap value stocks, as measured by the Portfolioâs benchmark, the RLV, outperformed the SPX, returning 10.08% versus 5.78%, respectively.",https://finnhub.io/api/news?id=83cfacfb4579a855fd06d593e71e08d2f068a89833c497e65e388d71c7acef61
NVDA,"Stock Market Euphoria To $100,000 Bitcoin, What I Got Right And Wrong In 2024",https://static.seekingalpha.com/cdn/s3/uploads/getty_images/1165053726/image_1165053726.jpg?io=getty-c-w1536,SeekingAlpha,"Financial writer predicts futures market trends for 2024 including S&P 500 exceeding expectations and Bitcoin hitting $100,000. Read more here.",https://finnhub.io/api/news?id=de96f172b8c53ec63eecdad16b8ea5da8ce4c6d12ad13ec494856b86a5dbea8f
NVDA,Prediction: This Under-The-Radar Opportunity Will Be the Most Important Part of Palantir's Business in 2025,https://g.foolcdn.com/editorial/images/800542/gettyimages-2162363632-1.jpg,Yahoo,"The launch of the Palantir Artificial Intelligence Platform (AIP) in 2023 has fueled new opportunities for the company, but one area seems to be flying under the radar.",https://finnhub.io/api/news?id=254afa937f3384ae12e29dc2046a81455e311b75df58a869c3d567c5a9fd1ca4
NVDA,"Investing $5,000 in Each of These 3 Stocks at the Start of 2024 Would Have Created a Portfolio Worth More Than $100,000 Today",https://g.foolcdn.com/editorial/images/800299/an-excited-investor.jpg,Yahoo,"While chipmaker Nvidia is an obvious example of a top growth stock to own given its more than 2,500% return over the past five years, there are many other stocks that have produced incredible gains in a short stretch.  Three stocks that have done phenomenally well this year and have outperformed Nvidia are AppLovin (NASDAQ: APP), MicroStrategy (NASDAQ: MSTR), and Summit Therapeutics (NASDAQ: SMMT).  If you invested $5,000 into each one of these stocks at the beginning of the year, the total of those investments would be worth more than $100,000 right now.",https://finnhub.io/api/news?id=7413cd18172ed02889f4b92cdade040f44e2abc47462ecaf8683fdd821796dd1
NVDA,Can Palantir Stock Become the Next Nvidia?,https://g.foolcdn.com/editorial/images/800436/discussing-internal-growth-on-big-screen-1522425869.jpg,Yahoo,"With its stock up 2,500% in the past five years, it's perhaps not surprising that investors are looking for the next Nvidia (NASDAQ: NVDA).  The overwhelming response was Palantir (NASDAQ: PLTR).  With that said, let's dig into what it would take for Palantir stock to become the next Nvidia in the coming years.",https://finnhub.io/api/news?id=6701a64449d893510a0c51fb5bfea8fcf95751ee24d940df4534d25ca4f1d7ae
NVDA,Prediction: AMD Stock Will Soar Over the Next 8 Years. Here's 1 Reason Why.,https://g.foolcdn.com/editorial/images/800714/amd-headquarters-santa-clara-with-amd-logo-on-building_amd_advance.jpg,Yahoo,"Advanced Micro Devices (NASDAQ: AMD) stock has sold off in recent weeks.  Weak PC sales and worries about competition in the artificial intelligence (AI) accelerator market seem to have weighed on the stock.  Its $18 billion in revenue for the first nine months of 2024 rose 10%, far below the triple-digit revenue increases of its main rival, Nvidia.",https://finnhub.io/api/news?id=87fcee786a60d93930b31281bc55b91976ed1189579ab69b483ea88aa3699e59
NVDA,"Nvidia under fire, solar eclipses on demand, and Elon Musk vs. the SEC: Tech news roundup",https://media.zenfs.com/en/quartz.com/b6f687dcbb04844d4b94da96a110ca3c,Yahoo,Nvidia (NVDA) is under investigation for allegedly violating anti-monopoly laws in China.,https://finnhub.io/api/news?id=1df01775f65f1325f6ca9db77be11641a4a0de7aad08538083f20101b81d7d87
NVDA,Should You Forget Nvidia and Buy This Tech Stock Instead?,https://g.foolcdn.com/editorial/images/800731/computer-circuit-board.jpg,Yahoo,"As the old adage goes, past performance is no guarantee of future results.",https://finnhub.io/api/news?id=49b216a7a3585a343abf04c203da88d2ece2e40157a066254590a29529b34d29
NVDA,3 Top Tech Stocks to Buy Right Now,https://g.foolcdn.com/editorial/images/800716/squinting-at-smartphone-over-glasses.jpg,Yahoo,Searching for undervalued tech gems while rebalancing your portfolio for 2025? Here are three compelling tech stocks that could deliver big returns.,https://finnhub.io/api/news?id=54f400bfc8a6468076c542ce8a10f4139eac02e244f5484dbcf53fbd3edb7afb
NVDA,Here Are My Top 10 Stocks for 2025,https://g.foolcdn.com/editorial/images/799661/stock-chart-rising-and-numbers-flipping-from-2024-to-2025.jpg,Yahoo,"If I had to buy just one stock from this list for 2025, I'd pick Taiwan Semiconductor Manufacturing (NYSE: TSM).  Taiwan Semi is the world's leading contract chip manufacturer and makes chips for nearly every company that produces anything related to high technology or AI.  With Wall Street expecting 25% revenue growth in 2025, I'd expect Taiwan Semi's stock to excel next year.",https://finnhub.io/api/news?id=bfde0ba5060457a92208c9f112244e968a0952b3ac718892808a2e98acbb3932
NVDA,"Better Bargain ""Magnificent Seven"" AI Buy for 2025: Meta Platforms vs. Alphabet",https://g.foolcdn.com/editorial/images/800769/gettyimages-1191849990.jpg,Yahoo,"Technology stocks generally have soared this year, helping drive the S&P 500 toward a 27% gain.  Leading the way were a handful of stocks known as ""Magnificent Seven"" -- a reference to the 1960 Western.",https://finnhub.io/api/news?id=521ac733798ce0c92e908169073076299d0e40884b445bb6e4ec0d4e81f10ce2
NVDA,Missed Out On Nvidia's Run-Up? My Best Under-the-Radar AI Stock to Buy and Hold.,https://g.foolcdn.com/editorial/images/799589/nvda-nvidia-soun-soundhound-ai-stock-market-investment.jpg,Yahoo,"Over the last five years, Nvidia stock is up a staggering 2,500%.  With that in mind, let's have a look at another stock -- one that might still be in the early innings of a multiyear uptrend: SoundHound AI (NASDAQ: SOUN).  To understand why SoundHound AI is such a great under-the-radar choice, you need to understand what the company does.",https://finnhub.io/api/news?id=f6c7e26bc63828aa4ce1caceaf52867c387ace154a1de85232922598ee12b756
NVDA,"1 Unstoppable Stock That Could Join Nvidia, Apple, Microsoft, Amazon, Alphabet, Meta, and Tesla in the $1 Trillion Club",https://g.foolcdn.com/editorial/images/800665/a-person-looking-at-server-hardware-while-holding-a-laptop-computer.jpg,Yahoo,Oracle is fast becoming a leader when it comes to building data centers for artificial intelligence development.,https://finnhub.io/api/news?id=9b2a1a33aad3bc9758348f2ddf735cffd25bbb68c1464ac6cf27870868834a04
NVDA,Meet the Supercharged Growth Stock Poised to Hit $20 Trillion by 2030 According to 1 Wall Street Analyst,https://g.foolcdn.com/editorial/images/800893/person-looking-at-graphs-and-charts-happy-because-the-stock-market-went-up.jpg,Yahoo,Strong secular tailwinds and multiple opportunities should conspire to drive this artificial intelligence (AI) pioneer higher.,https://finnhub.io/api/news?id=53b749d9047c5b5e75811e13296409b8c3f10ddf9ebb93f53bc4f716b5fd2b07
NVDA,"8 Funds For Potential $5,000 Monthly Income And Financial Freedom",https://static.seekingalpha.com/cdn/s3/uploads/getty_images/1346786874/image_1346786874.jpg?io=getty-c-w1536,SeekingAlpha,"Learn how to build a diversified fund-based portfolio for passive income and potential market-matching growth, generating $5,000 monthly income.",https://finnhub.io/api/news?id=2762ad3defc0d3ec9b1ccb3e9f3d9e1f2d792d5bca4f471d24b6710f2312df1c
NVDA,Nvidia Stock Dips 2.5% on Valuation Concerns and Regulatory Risks,https://media.zenfs.com/en/us.finance.gurufocus/03412812937b5e844d13e61d0b389761,Yahoo,Regulatory Uncertainty and Profit-Taking Weigh on Nvidia Stock,https://finnhub.io/api/news?id=c62639112e5057d1e62369c7871469736579f680b6bcded183deaa58cfc46dbf
NVDA,It Is The Right Time To Be A Retirement Income Investor,https://static.seekingalpha.com/cdn/s3/uploads/getty_images/640052718/image_640052718.jpg?io=getty-c-w1536,SeekingAlpha,Discover the key principles for maximizing retirement income investing and exploring high and durable income yields in price-return based strategies.,https://finnhub.io/api/news?id=e3e47d475350d28a0cf9d20e66902750d589f7ec2cb2b335b2a570833de53e45
NVDA,11%+ Yields From AI Stocks: QQQI Vs. QYLD,https://static.seekingalpha.com/cdn/s3/uploads/getty_images/1827973845/image_1827973845.jpg?io=getty-c-w1536,SeekingAlpha,Compare QQQI and QYLD funds for high yields from mega-cap AI companies.,https://finnhub.io/api/news?id=7234e103251b042c410d50d8e50cc6d7710d7ab15eb4fad16cab26c6faf9ddd1
NVDA,Billionaire David Tepper Sells Nvidia Stock and Buys a Shocking Artificial Intelligence (AI) Stock Instead,https://g.foolcdn.com/editorial/images/800803/investor-44.jpg,Yahoo,"Nvidia (NASDAQ: NVDA) has been the foundation of the artificial intelligence (AI) boom.  Its graphics processing units power virtually all of the most advanced AI systems, and the company has a strong presence in adjacent markets like AI networking equipment and software development tools.",https://finnhub.io/api/news?id=70c9b38d18bca19bb6fb685fcc6a665fdaaa48c9c138e2552c2d6b07efee1111
NVDA,Broadcom: Don't Let Your AI Enthusiasm Go Overboard (Rating Downgrade),https://static.seekingalpha.com/cdn/s3/uploads/getty_images/1193973091/image_1193973091.jpg?io=getty-c-w1536,SeekingAlpha,"Discover how Broadcom's booming AI business and partnerships like with Apple are driving its stock surge, but is the near-term upside limited?",https://finnhub.io/api/news?id=52b6598405563109da55c1ffc4c3b185a15352fc7a2815082f204ad27520ddc2
NVDA,Where Will Nvidia Stock Be in 5 Years?,https://g.foolcdn.com/editorial/images/800621/future-of-nvidia-ai-market-leader.jpg,Yahoo,"While it's still undoubtedly the most watched stock in tech, some of the heat surrounding Nvidia (NASDAQ: NVDA) seems to have cooled over the last few weeks.  At this point, it's not enough for the company to post great numbers.  For Nvidia to really move the needle, it has to blow them out of the water.",https://finnhub.io/api/news?id=6d8c17bd048817dad7fc8cc0fc0034da5c90ea0c0b7bbd13028ed67d9ef260d2
NVDA,QQQE: Equal-Weighting Strategy Won't Fully Capture Technological Megatrends,https://static.seekingalpha.com/cdn/s3/uploads/getty_images/1854380743/image_1854380743.jpg?io=getty-c-w1536,SeekingAlpha,"QQQE's equal-weighting strategy reduces concentration risk but incurs higher expenses, limiting tech sector growth potential for long-term investors. See more.",https://finnhub.io/api/news?id=4a65e103ab633849b27d0a6b7120a1511003526e43feacac15db42dba72bb906
NVDA,"Semiconductor Recovery Expands Beyond AI To Automotive, PCs",https://static.seekingalpha.com/cdn/s3/uploads/getty_images/2075787099/image_2075787099.jpg?io=getty-c-w1536,SeekingAlpha,"For the first time in several quarters, the broader semiconductor sector is showing early signs of recovery in terms of clearing inventory. Read more here.",https://finnhub.io/api/news?id=0c2a5b33f3e2bd926947015cf18c77cbb404de1de52ff8cc4f1dc6e724a12581
NVDA,Michael Dell Spent 40 Years Preparing for an AI Boom No One Expected,,Yahoo,The man who founded Dell in a Texas dorm room has transformed his company. It’s not just about PCs anymore.,https://finnhub.io/api/news?id=37a159bc1d6a1bde88fcafb92d99b2d3c8f2ddf191c5e7e0321eb36b67d04b3e
NVDA,"Nvidia, inflation data, and AI: ICYMI",https://s.yimg.com/ny/api/res/1.2/ZPmvHiX6QulLCZNsRvRo9A--/YXBwaWQ9aGlnaGxhbmRlcjt3PTEyMDA7aD02NzY-/https://s.yimg.com/os/creatr-uploaded-images/2024-12/e790e6b0-b99a-11ef-aab7-1d8da20aeeba,Yahoo,"There was a flood of news the week of December 9, 2024. One of the biggest data events was the release of the November Consumer Price Index (CPI) report that showed inflation rose as expected in the month. Hear expert commentary from: EY chief economist Greg Daco and State Street senior global macro strategist Marvin Loh Former Cleveland Fed President Loretta Mester One stock that was in focus was Nvidia. The Chinese government has reportedly opened an antitrust probe into the tech giant. Listen to expert analysis from: Futurum Group CEO Daniel Newman Macrolens chief strategist Brian McCarthy KraneShares CIO Brendan Ahern AI was also a big theme, especially with the launch of OpenAI's Sora video generation feature. Get insight from: Cloudflare Chief Technology Officer John Graham-Cumming Gusto senior economist Nich Tremper C3.ai founder and CEO Tom Siebel For more expert insight and the latest market action, click here.",https://finnhub.io/api/news?id=6238c82eef6b57089b0f1bf01bfb6cc9eb37cd7fc8d79afdafb0e7326b7a76c2
NVDA,"Best Way To Invest $100,000: Build An 8-Stock Portfolio For Growth And Value",https://static.seekingalpha.com/cdn/s3/uploads/getty_images/1445810162/image_1445810162.jpg?io=getty-c-w1536,SeekingAlpha,Learn how to maximize returns by focusing on high-conviction stocks across diverse sectors and using proven investment strategies.,https://finnhub.io/api/news?id=55d1529df95faa211f30c69c3af5c9bc27914aaccba3736ed4c24b15134a2681
NVDA,Broadcom Stock Soars on Upbeat AI Talk,,Yahoo,"Broadcom CEO Hock Tan’s upbeat projections of AI chip growth potential lifted the company’s stock 24%, despite some fuzziness in his commentary. Plus, The Information’s stories of the week.",https://finnhub.io/api/news?id=8f23e67f866d9c3c01115064f544895e59ef103daf9d51a7e6861ed9276f9e12
NVDA,"The Score: General Motors, Nvidia, UnitedHealth and More Stocks That Defined the Week",,Yahoo,General Motors  has scrapped its robotaxi program after nearly a decade—and $10 billion of development.  GM said it owns about 90% of Cruise and intends to buy out the remaining investors.  It plans to combine its Cruise and GM technical teams into a single effort to advance autonomous and assisted driving.,https://finnhub.io/api/news?id=c15b179ccb06142fbb240e59bb0c3f85b87316e8aaf5926589002bde322650cc
NVDA,Where Will Nvidia Stock Be in 10 Years?,https://g.foolcdn.com/editorial/images/800381/gettyimages-1423544107.jpg,Yahoo,"Long-term investment is the key to life-changing returns in the stock market, and few companies highlight this concept better than Nvidia (NASDAQ: NVDA).  Let's examine the pros and cons of Nvidia stock to determine whether the legendary technology giant still has multibagger potential over the long term.  Nvidia's core business has always been designing and selling graphics processing units (GPUs), a type of computer chip capable of parallel processing (running multiple calculations simultaneously).",https://finnhub.io/api/news?id=8b7a889afad1fcdeec002954a3e62b938bc2383f69a913b363b08d71647b52b6
