related,headline,image,source,summary,url
NVDA,Bitcoin’s $100K Breakout Pause Likely Due to Liquidity Factors and Nvidia's Stalled Rally,https://cdn.sanity.io/images/s3y3vcno/production/772d1d0caa3e95bd0c4af852b06e562c75766a83-1280x850.jpg?auto=format,Yahoo,Slower inflow of liquidity and risk-off cues from NVDA might be holding back the upside.,https://finnhub.io/api/news?id=5d0fa66a0528740d82afa2634201189b9c647cef7d429b2b8e0335a4d7fefd85
NVDA,Allspring Growth Fund Q3 2024 Commentary,https://static.seekingalpha.com/cdn/s3/uploads/getty_images/2149367131/image_2149367131.jpg?io=getty-c-w1536,SeekingAlpha,The Allspring Growth Fund underperformed the Russell 3000 Growth Index during the third quarter of 2024. Click here to read the full commentary. ,https://finnhub.io/api/news?id=c07c5d471c9e7244ca4fd4fe14544139ed5e5eb49520f85f40fbbe47f86ccb92
NVDA,Allspring Emerging Markets Equity Income Fund Q3 2024 Commentary,,SeekingAlpha,,https://finnhub.io/api/news?id=b20212e36c0458763accb9eae1ff1f183a9692ea7cbd9fdb6392c38e63f3c41e
NVDA,Why Nvidia (NVDA) Stock Is Declining Again Today,https://s.yimg.com/ny/api/res/1.2/xtlS.VjuHR4pKRpFLOUG2A--/YXBwaWQ9aGlnaGxhbmRlcjt3PTEyMDA7aD04MDA-/https://media.zenfs.com/en/insidermonkey.com/4beabd482637ec7f5549a99b77c1d1cd,Yahoo,"NVIDIA Corporation (NASDAQ: NVDA) shares continued to slide on Tuesday, falling more than 3% after a Chinese regulator announced that it was investigating the chipmaker for possible violations of the country’s antimonopoly law. On Monday, December 9, the Chinese government announced that The State Administration for Market Regulation (SAMR) had initiated an investigation concerning Nvidia’s acquisition […]",https://finnhub.io/api/news?id=b21affd21753d9aa8f3c5b859d61ae651919cee6e0e613ad900bdbe1f1c4d982
NVDA,New AI leader outshines Magnificent 7 stocks in top funds list,,Yahoo,Most Magnificent 7 stocks are losing favor to a rising AI star,https://finnhub.io/api/news?id=3fc6db0e1c60849dd68644808c3e1b2273ac51d3122156c79c49936ab04a6998
NVDA,"Apple market cap, momentum, MicroStrategy: Market Takeaways",https://s.yimg.com/ny/api/res/1.2/0ChszH9mEZ7Kuh9IJ4qdGA--/YXBwaWQ9aGlnaGxhbmRlcjt3PTEyMDA7aD02NzY-/https://s.yimg.com/os/creatr-uploaded-images/2024-12/d1517e20-b745-11ef-b60f-e330e56d85e5,Yahoo,"After US market indexes (^DJI, ^IXIC, ^GSPC) closed in negative territory for the second session in a row, Apple's (AAPL) market cap crossed past a record $3.7 trillion. Yahoo Finance markets and data editor Jared Blikre joins Josh Lipton on Asking for a Trend to explain the trading day's biggest themes, including Apple's new market cap, momentum reversal patterns, and MicroStrategy's (MSTR) stock activity in relation to bitcoin (BTC-USD). To watch more expert insights and analysis on the latest market action, check out more Asking for a Trend here. This post was written by Luke Carberry Mogan.",https://finnhub.io/api/news?id=783ec3f7aa1fdf1a1aa13e809edb49d9df73857ad0db9682950bb6e8cecbcea5
NVDA,"These Stocks Moved the Most Today: Nvidia, Oracle, Tesla, Walgreens, Super Micro, Boeing, Alaska Air, MongoDB, and More",https://media.zenfs.com/en/Barrons.com/12ea0f43d8f8307249a68d1cb2e0587e,Yahoo,"Nvidia stock extends losses after China launches an antitrust investigation into the chip maker, Oracle shares fall as earnings at the enterprise software company miss forecasts, and Tesla’s stock price target is raised at Morgan Stanley.",https://finnhub.io/api/news?id=e9b96d74d41facbecb8a6afb407e9478e5413e03db4fc87bccd1caa2dd98ec43
NVDA,Tracking Ole Andreas Halvorsen's Viking Global Portfolio - Q3 2024 Update,https://static.seekingalpha.com/cdn/s3/uploads/getty_images/200502280/image_200502280.jpg?io=getty-c-w1536,SeekingAlpha,"Viking Global's 13F portfolio value increases to $27.44B with top holdings in U.S. Bancorp, Adobe, Apple, Philip Morris, and Visa. Check out the holdings in Q3.",https://finnhub.io/api/news?id=5efd2c4255a1a8e879cc8102b235c9f3e70681c08aaa35bd892aa269c29be0f0
NVDA,"Alphabet Surges 5%, Oracle Slides 8% on Missed Targets, Nvidia Slips 2.5%",https://media.zenfs.com/en/us.finance.gurufocus/7c3f7fce7ab9659e4746f66786c741f8,Yahoo,Stocks Hold Steady Ahead of Inflation Data; Alphabet Surges on Quantum Breakthrough,https://finnhub.io/api/news?id=53efde360ff8b65c94f27c9457cdc3613d70b648388d83b5f19351c7c541f75f
NVDA,The Year’s Best Dow Stock Not Named Nvidia,https://media.zenfs.com/en/Barrons.com/12ea0f43d8f8307249a68d1cb2e0587e,Yahoo,"Walmart  customers consider the retailer a happy place because of its low prices and “rollback” sales.  Nvidia  is the only stock in the  this year that has done better than Walmart, soaring nearly 175%.  The nearly unanimous answer from analysts is yes; 37 of the 41 sell-siders who follow the stock have Walmart rated a “Buy” or “Outperform,” compared with just three “Holds” and one “Sell.”",https://finnhub.io/api/news?id=b1df8fca8ed3adad6d32ea86de7f69528f33516937e0a89762158007910caa4c
NVDA,"These Stocks Are Moving the Most Today: Nvidia, Oracle, Tesla, C3.ai, Alaska Air, Planet Labs, MongoDB, and More",https://media.zenfs.com/en/Barrons.com/12ea0f43d8f8307249a68d1cb2e0587e,Yahoo,"Nvidia stock dips as China launches an antitrust investigation, Oracle shares fall as earnings at the enterprise software company miss forecasts, and C3.ai posts a narrower-than-expected quarterly loss but the stock tumbles on a disclosure the CEO is selling shares.",https://finnhub.io/api/news?id=ef5550c95117e718f7e1655b04f28e8ef6231eb3e5ab754fa3ce09a0575bc988
NVDA,"For ESGV, Ethics Is Not A Drag",https://static.seekingalpha.com/cdn/s3/uploads/getty_images/2152386308/image_2152386308.jpg?io=getty-c-w1536,SeekingAlpha,"Challenging a common prejudice, ESGV proves that some ethical principles in stock picking are not a drag on performance. Read the full ETF analysis here.",https://finnhub.io/api/news?id=564292357778d3dbef4ea1ba47eeb16f94d3b2f05ce01a2442a3230450c68889
NVDA,Nebius' Valuation Update After Backing From Nvidia,https://static.seekingalpha.com/cdn/s3/uploads/getty_images/894977258/image_894977258.jpg?io=getty-c-w1536,SeekingAlpha,"Discover why Nebius is a compelling investment opportunity in the AI industry, with a potential equity value of $18.4 billion by 2025.",https://finnhub.io/api/news?id=5741f1fc8b581a52848cc890b092ba379de841b6759d2762472b8b9dee27beca
NVDA,Super Micro CEO Confident in Nasdaq Listing Amid Reporting Delays; Nvidia Partner's Stock Slumps,https://media.zenfs.com/en/us.finance.gurufocus/7accc684e6ccea4efa8f5d1b61e564d6,Yahoo,"SMCI, a partner of NVIDIA, is facing financial reporting delays",https://finnhub.io/api/news?id=0c6f42487f4a8be1c05e1a69a077ce8d10c66f53dd638b6341c9857dee615074
NVDA,"Nvidia Turns Lower, Dragging Down the Major Indexes",,Yahoo,"The S&P 500 was hovering around breakeven and the Nasdaq Composite was up just 0.2% shortly after noon ET.  The Dow was up 22 points, or less than 0.1%.  Nvidia stock was down 1.8%, while the SOXX ETF was down 2%.",https://finnhub.io/api/news?id=b80f7605ee98ef45e9f1f060ebeb90aa3810a205183e9d81a0aee8d0fef4924d
NVDA,Cloudflare expected to deal with 'a variety' of chip providers: CTO,https://s.yimg.com/ny/api/res/1.2/OcyDYQBVwHyqXHfcSgpqoQ--/YXBwaWQ9aGlnaGxhbmRlcjt3PTEyMDA7aD02NzY-/https://s.yimg.com/os/creatr-uploaded-images/2024-12/1918ebe0-b713-11ef-b7df-4bdde2a88ab3,Yahoo,"While AI demand continues to strengthen across industries — worrying Wall Street over whether chipmakers and operators can meet this demand — Cloudflare (NET) Chief Technology Officer John Graham-Cumming finds that ""what we're seeing is the real growth of actual AI applications."" Graham-Cumming sits down with Seana Smith and Madison Mills on Yahoo Finance's Catalysts for a conversation about the broader AI landscape, including the heightened demand for Nvidia's (NVDA) landmark chips going into 2025. ""Obviously, Nvidia really is absolutely by far the market leader. But we continue to look at other chip manufacturers, other chips that are out there. And I fully expect over the next few years that within the Cloudflare network, there will be a variety of different providers for a variety of different types of models,"" the Cloudflare CTO states. Graham-Cumming comments on the likelihood that his company will rely on several chip providers. To watch more expert insights and analysis on the latest market action, check out more Catalysts here. This post was written by Luke Carberry Mogan.",https://finnhub.io/api/news?id=8e3d7a9a97234ce0b4f11e1213338e2db058daa8da4e08de6c225f0892885a58
NVDA,Nvidia faces antitrust probe in China,https://www.verdict.co.uk/wp-content/uploads/2024/12/nv-shutterstock_1606529806.jpg,Yahoo,Chipmaker Nvidia is being scrutinised for its recent activities and its acquisition of Mellanox Technologies.,https://finnhub.io/api/news?id=dda95002e0056428e4a9ae3b8b2c7a93332ffa1c2b8ba684004a18613ff2db1a
NVDA,See Which Stocks Are  On The IBD Breakout Stocks Index,https://www.investors.com/wp-content/uploads/2019/03/Stock-Uptrend-33-adobe.jpg,https://www.investors.com,"Get alerts to potential breakout stocks, along with technical analysis of the stock charts to see the best time to buy and what telltale signs to look for.",https://finnhub.io/api/news?id=5513b42d4a764f92cea3fa1ab951fa77b86d8c0501435a96c57480f373ebfca3
NVDA,Dan Niles on Nvidia (NVDA): People Just Want to Believe ‘Santa Claus Rally’,https://s.yimg.com/ny/api/res/1.2/kZveoOmr3ngssVpudK1u4A--/YXBwaWQ9aGlnaGxhbmRlcjt3PTEyMDA7aD02NzM-/https://media.zenfs.com/en/insidermonkey.com/aa94e059977d3251b8b0630718e013fc,Yahoo,"We recently published a list of 10 Buzzing AI Stocks This Week. In this article, we are going to take a look at where Nvidia Corp (NASDAQ:NVDA) stands against other buzzing AI stocks this Week. Paul Hickey, Bespoke Investment Group co-founder, said while talking to CNBC in a latest program that despite the market gains still […]",https://finnhub.io/api/news?id=8e2f6a8532f1fb3b558cfec9be0c26b9d13a0aefe2b606751530389206f81dde
NVDA,"Nvidia Stock Gains. What TSMC Sales, China Probe Mean for Chip Maker.",,Yahoo,"Nvidia stock rose Tuesday on the back of a sales boost for the chip maker’s key manufacturer, helping lift the shadow of an antitrust investigation in China.  Nvidia  shares were up 1.6% at $141.08 in early trading, as it continues in its range of between $135 and $145 of the past few weeks.  The stock fell 2.6% on Monday after China’s State Administration for Market Regulation said it had initiated an investigation into Nvidia due to a suspected violation of antimonopoly law.",https://finnhub.io/api/news?id=2a1634530424bb0b160ae23194637d14436e9faf891a73fa9676d247aa7ef29b
NVDA,TSMC Sales Are Booming. Why the Stock Is Falling.,,Yahoo,"The sales surge signals the chip maker’s continued momentum amid the artificial-intelligence boom, though investors weren't enthused.",https://finnhub.io/api/news?id=9f282548103af0bcee0532cf15ac7197df19c512a71f1cbcde17c6a7c6b83268
NVDA,Dow Jones Slides As Inflation Data Looms; Nvidia Rebounds From Key Level,,Yahoo,The Dow Jones slid Tuesday as key inflation reports loom later this week. Nvidia stock rebounded from a key support level.,https://finnhub.io/api/news?id=46115cf51744a8d233b39a50b921ea1eb2fbd85939e1ff18dbcc9bb9f54b3d5d
NVDA,"AMD downgraded, PayPal upgraded: Wall Street’s top analyst calls",,Yahoo,"The most talked about and market moving research calls around Wall Street are now in one place. Here are today’s research calls that investors need to know, as compiled by The Fly. Top 5 Upgrades: BofA upgraded PayPal (PYPL) to Buy from Neutral with a price target of $103, up from $86. PayPal is demonstrating increased turnaround progress just over a year after C-level management change, says the firm, which sees potential 2025 acceleration in underlying transaction profit growth. Barclays upgra",https://finnhub.io/api/news?id=009d1d8c51a1ec740bf71156219503fda33da9d443a8068a6767f6fa9ed80f07
NVDA,Taiwan Semi November Revenue Ups 34% Strengthened by AI and Smartphone Demand,https://media.zenfs.com/en/Benzinga/d2f2991f789a9d26959e7594a0f77373,Yahoo,"Taiwan Semiconductor Manufacturing Co (NYSE:TSM) reported a topline growth of 34% year-on-year to $8.55 billion in November 2024. Revenue for January through November 2024 grew by 31.8% year over year to $81.05 billion, testimony to the continued artificial intelligence frenzy. The contract chipmaker’s market share grew to 64.9%, up from 62.3% Q/Q, helping it retain the top position in the global wafer foundry business. This is due to the smartphone and AI-related demand for its 3nm and 5nm tech",https://finnhub.io/api/news?id=05eeab5d31e2bbc19cc84f1761fee1db7b9a25264d3546f8abfabc63e0090b30
NVDA,4 Brilliant Growth Stocks to Buy Now and Hold for the Long Term -- Including Nvidia,https://g.foolcdn.com/editorial/images/800244/getty-couple-smiling-at-phone-happy-success.jpg,Yahoo,"Over many decades, the stock market has averaged annual returns of close to 10%.  What if you'd like to choose some individual growth stocks in which to invest?  Any list of promising growth stocks almost seems incomplete without Nvidia (NASDAQ: NVDA), because it's been a phenomenal performer.",https://finnhub.io/api/news?id=4ed64898c4a46cbbfd377ea6118039e8a893e46d06e4504278913528ccda156d
NVDA,Pioneer Balanced ESG Fund Q3 2024 Performance And Market Commentary,https://static.seekingalpha.com/cdn/s3/uploads/getty_images/1401878862/image_1401878862.jpg?io=getty-c-w1536,SeekingAlpha,"Pioneer Balanced ESG Fundâs Class Y shares returned 4.09% in the third quarter, underperforming the Fundâs equity and fixed income benchmarks. Read more here.",https://finnhub.io/api/news?id=342ef00ffdf9360c3d2a739a17135c531918eea0645a9234bd618c6fc0d2e531
NVDA,Prediction: This Artificial Intelligence (AI) Chip Stock Is Going to Skyrocket After Dec. 12,https://g.foolcdn.com/editorial/images/800378/ai-written-on-circuit-board.jpg,Yahoo,"There is no doubt that Nvidia (NASDAQ: NVDA) is the dominant player in the market for artificial intelligence (AI) chips, as its graphics processing units (GPUs) have played a central role in training popular AI models such as ChatGPT and Llama.  As a result, Nvidia's data center revenue rose by a remarkable 112% year over year in the third quarter of its fiscal 2025 to a record $30.8 billion, while AMD's revenue from this segment came in at just $3.5 billion in its most recently reported quarter.  At the same time, some investors seem a tad concerned about the relative slowdown in Nvidia's growth.",https://finnhub.io/api/news?id=29a6e209265f61071a9c5a907596955ebf41f98f15b457648f0d22cef7327b1f
NVDA,The Road Ahead For Semiconductor Stocks,https://cf-images.us-east-1.prod.boltdns.net/v1/static/3582280029001/07ef1052-600d-44d4-bbfa-7534df0a40ac/12498cf0-3d66-4b09-9652-91edc2058b38/1920x1080/match/image.jpg,SeekingAlpha,"Excitement around AI has benefitted the semiconductor industry, but after the run in the space, is there still opportunity? TD Asset Management's Andrew McKendry discusses.",https://finnhub.io/api/news?id=ca6c97051f24c07bd8cbce759b6c55daa8ec033b8eaa91c71ff88221a4655185
NVDA,Want to Buy Nvidia Stock Before the End of the Year? Consider These 7 Magnificent Nvidia-Heavy Vanguard ETFs.,https://g.foolcdn.com/editorial/images/800256/gettyimages-1346508441-1201x698-813e3a7-1.jpg,Yahoo,"Nvidia (NASDAQ: NVDA) has followed up its unbelievable 2023 performance with another jaw-dropping year-to-date gain of 180% at the time of this writing.  Nvidia's earnings continue to impress, and there are expectations for even more growth in 2025.  Exchange-traded funds (ETFs) that hold Nvidia are excellent ways to get exposure to the company while maintaining diversification.",https://finnhub.io/api/news?id=2719dbb4f9b450af25de28d1320ab28ccabde94d6a49458a1779251aec7926c1
NVDA,"Step Aside AI, Google's Quantum Computer Is Here",https://static.seekingalpha.com/cdn/s3/uploads/getty_images/2151292894/image_2151292894.jpg?io=getty-c-w1536,SeekingAlpha,"Googleâs Willow chip advances quantum computing with major potential. See why GOOGL stock is a must-own, benefiting from breakthroughs in AI and healthcare.",https://finnhub.io/api/news?id=16626e3370e5505e20ed94d7c2e183145662910ba36f958153bfd3a2d8b4c6d2
NVDA,Fresh Insights: Upgrading Nvidia To Buy For Aggressive Growth Opportunities,https://static.seekingalpha.com/cdn/s3/uploads/getty_images/1167425335/image_1167425335.jpg?io=getty-c-w1536,SeekingAlpha,"Nvidia's position in AI and computing, coupled with a $2.4 trillion market potential, make it a buy despite tariff risks. Click here to read my NVDA update.",https://finnhub.io/api/news?id=23e3aa247f3f178103ded5bc490b8b12c5088254a1e2cb641f04310459b83d21
NVDA,"Meta's Orion Headsets Can Be Big, But Won't Be Impactful For Some Time",https://static.seekingalpha.com/cdn/s3/uploads/getty_images/2086690371/image_2086690371.jpg?io=getty-c-w1536,SeekingAlpha,"Meta Platforms has strong growth catalysts in Meta AI and AR eyewear, driving growth and potential margin accretion going into eFY26. Read more here.",https://finnhub.io/api/news?id=d50d859bf28ad1e2612cdab84ea6019387147ee5248ebbdd3fd9bdcc45f94783
NVDA,Market Leadership Is Narrow. Your Portfolio Shouldn't Be,https://static.seekingalpha.com/cdn/s3/uploads/getty_images/1477909330/image_1477909330.jpg?io=getty-c-w1536,SeekingAlpha,"2024 S&P 500 Index performance has been among some of the strongest in history, adding to similarly strong performance in recent years.",https://finnhub.io/api/news?id=bfd2bc7d49a8be9e8448b2e327b0cec4e3ca01f178482b9dbb6cfe300de4b04a
NVDA,Tokyo stocks edge up in morning as weak yen lifts exporters,,Finnhub,"Tokyo stocks rose Tuesday morning as a weaker yen lifted exporters, but gains were trimmed by selling of some semiconductor-related shares linked to Nvidia Corp. after reports that China has opened a...",https://finnhub.io/api/news?id=492033b3e8ffbab9b2a169cb608dd935b11085a59bd2260245332e7de4411679
NVDA,10 Charts That Show The Unprecedented Scale Of The Magnificent 7 Bubble,https://static.seekingalpha.com/cdn/s3/uploads/getty_images/487259374/image_487259374.jpg?io=getty-c-w1536,SeekingAlpha,The Magnificent Seven stocks represent 33% of the entire S&P 500's market cap. Click here to read more about Mag 7 stocks through charts.,https://finnhub.io/api/news?id=b6ae67f60f8f53d62811557bd2910b9029210d111eebf853cfa1284539f6f70e
NVDA,"Dow Jones Futures: AppLovin, Cava, MicroStrategy, Palantir Dive; Nvidia Falls To Support Level",,DowJones,"Dow Jones Futures: AppLovin, Cava, MicroStrategy, Palantir Dive; Nvidia Falls To Support Level",https://finnhub.io/api/news?id=90f600104730bffa6a687c8eaa1a471088f485fe76837ba672da1e4b818b2fa8
NVDA,The Secrets of the Man Who Made Nvidia the World’s Most Valuable Company,,DowJones,The Secrets of the Man Who Made Nvidia the World’s Most Valuable Company,https://finnhub.io/api/news?id=345df9fbbb8e86cda7056a985091024ed8c5c2387633b0b98b99ee83014418b5
NVDA,Texas Pacific: 70% Down To Fair Value,https://static.seekingalpha.com/cdn/s3/uploads/getty_images/488326931/image_488326931.jpg?io=getty-c-w1536,SeekingAlpha,"Texas Pacific Land's recent stock surge is not sustainable, with valuation metrics indicating a potential 70% downside ahead. Learn more about TPL stock here.",https://finnhub.io/api/news?id=de2d1af49f773310fcfc8bd0e19043fc63b135d939b00c47d5513804537beb95
NVDA,"Nvidia Q3: AI Dominance, Strong Growth Make It A Strong Buy For The Future",https://static.seekingalpha.com/cdn/s3/uploads/getty_images/1879228542/image_1879228542.jpg?io=getty-c-w1536,SeekingAlpha,"Nvidia Corporation's Q3 2025 earnings report highlights exceptional growth and strong financial health, making it a strong buy. Click for more on NVDA stock.",https://finnhub.io/api/news?id=44abeedce700fdd8aa7977d70a6886a77511060f40e43624e5f480ab16f0d7df
NVDA,China Opens Probe Into Nvidia,,Finnhub,"-- China has opened a probe into Nvidia over suspicions that the US chipmaker broke anti-monopoly laws around a 2020 deal, taking aim at the AI heavyweight as Washington ramps up sanctions. ...",https://finnhub.io/api/news?id=6d79050a8992aeab7781f20f0540cd33bf548e10721fa09f45f9cf0c311a9c81
NVDA,Dow Jones Flat As Nvidia Falls On China Probe; Palantir Reaches New High (Live Coverage),,Yahoo,The Dow Jones and S&P 500 were little changed Monday. Nvidia stock sank on a China probe while Palantir popped on the stock market today.,https://finnhub.io/api/news?id=ee0c243a0dce5cf6c7e161a3560ce8c3d0b972912c95ccc47564de553fb68b5d
NVDA,"Stocks Near Day's Lows As Nvidia Has Bad Day; Amazon Streak Threatened, Drug Name Plummets (Live Coverage)",,DowJones,"Stocks Near Day's Lows As Nvidia Has Bad Day; Amazon Streak Threatened, Drug Name Plummets (Live Coverage)",https://finnhub.io/api/news?id=4e15d0c0c188bcfb80a95f46ce57b29350188343a535505df66269fccbc39dd6
NVDA,Nvidia Stock Falls As China Opens Antimonopoly Probe,https://media.zenfs.com/en/ibd.com/d187343775b28a727f0898983dc48dae,Yahoo,Nvidia stock dropped on Monday after China's market regulator launched an investigation into the AI chipmaker.,https://finnhub.io/api/news?id=4ac4349218a8ffa038a4a797d140232986188efb6b8181bca6fdd9e799b042c9
NVDA,Nvidia slides after China says it's probing the AI chip company for violating anti-monopoly laws,https://s.yimg.com/ny/api/res/1.2/RVpocpmd0_7frFdRVKmc3Q--/YXBwaWQ9aGlnaGxhbmRlcjt3PTEyMDA7aD04MDA-/https://media.zenfs.com/en/ap_finance_articles_694/9e04681de2390f1000013ca02cf1db63,Yahoo,"Shares of Nvidia slid early Monday after China said it is investigating the high-flying U.S. microchip company over suspected violations of Chinese anti-monopoly laws.  In a brief press release with few details, Chinese regulators appear to be focusing on Nvidia's $6.9 billion acquisition of network and data transmission company Mellanox in 2019.  Nvidia shares dipped 2.5% in morning trading Monday, falling below $140 each.",https://finnhub.io/api/news?id=23676f77ed873fdf027238cfbc4bfc7a3b8aa49118f210fe1effdea3eb03d5a4
NVDA,China's Nvidia probe is an escalation in US trade war: Expert,https://s.yimg.com/ny/api/res/1.2/zoTneGIIKZpd7i6GWkiUNA--/YXBwaWQ9aGlnaGxhbmRlcjt3PTEyMDA7aD02NzY-/https://s.yimg.com/os/creatr-uploaded-images/2024-12/abbd6b40-b63e-11ef-95e6-cec8beae303c,Yahoo,"Nvidia (NVDA) shares are trading lower after news that China has opened an antitrust probe into the artificial intelligence (AI) chip maker. The company is also facing a US antitrust investigation. The Futurum Group CEO Daniel Newman joins Morning Brief with Seana Smith and Brad Smith to discuss his read on the probe and what it means for Nvidia as well as US-China trade relations. ""Nobody should be surprised to hear about an ongoing set of probes against Nvidia, especially coming from China,"" Newman says, explaining there are ""two sides to this one:"" the ""ongoing microaggressions that exist between Chinese and US firms"" and ""China [continuing] to struggle to keep up with the most leading edge advanced AI chip"" so ""they probably want to do what they can to slow US firms down."" The US has limited the export of semiconductors to China to minimize China's access to advanced chips. President-elect Donald Trump has said he plans to enforce a 60% tariff on Chinese goods. ""I think what we have here is really more of a macro geopolitical strain than a real problem, but Nvidia is so successful that they're going to get probed by every regulator in the world over the next few years."" To watch more expert insights and analysis on the latest market action, check out more Morning Brief here. This post was written by Naomi Buchanan.",https://finnhub.io/api/news?id=8006bdbb17ae2d5d09af3f41dead85f2c05656cd10fc619add5e87f0b23b2960
NVDA,Mag 7's profit growth forecasted to slow in 2025: Bloomberg,https://s.yimg.com/ny/api/res/1.2/tG5KQdXydkIg3QUJ_BHItA--/YXBwaWQ9aGlnaGxhbmRlcjt3PTEyMDA7aD02NzY-/https://s.yimg.com/os/creatr-uploaded-images/2024-12/f6d1e380-b63f-11ef-8a5f-eaa16adeca02,Yahoo,"As the S&P 500's (^GSPC) Magnificent Seven — Meta Platforms (META) Microsoft (MSFT) Alphabet (GOOGL, GOOG), Amazon (AMZN), Apple (AAPL), Nvidia (NVDA), Tesla (TSLA) — could see its profit growth slow from 34% to 18% in 2025, Bloomberg Intelligence reports the healthcare sector could take the lead. Yahoo Finance host Madison Mills joins the Morning Brief to break down Bloomberg Intelligence's latest earnings growth estimates. To watch more expert insights and analysis on the latest market action, check out more Morning Brief here. This post was written by Luke Carberry Mogan.",https://finnhub.io/api/news?id=e7641cfb80e12015bfa86c7697cb97ec1ab77678524d7be5fd06baaaf8c00382
NVDA,Nvidia Under Fire: Beijing Investigates $7B Mellanox Deal Amid U.S.-China Tech Showdown,https://media.zenfs.com/en/us.finance.gurufocus/03412812937b5e844d13e61d0b389761,Yahoo,"Nvidia faces scrutiny over Mellanox deal, as Beijing investigates compliance with fair-treatment guarantees for Chinese firms",https://finnhub.io/api/news?id=c0311d194330e4dcf1ee62abec6e462fa77661a0a13fd805be5ce7484e419987
NVDA,Nvidia is facing an antitrust investigation in China,https://media.zenfs.com/en/quartz.com/054cea82582ca0a2cb1a778a377ec77b,Yahoo,Nvidia (NVDA) is under investigation for allegedly violating anti-monopoly laws in China.,https://finnhub.io/api/news?id=716ed89c233f75aa0e2a05e16cf2ff88a21105a00c85ed531ad4ba53eba54bc3
NVDA,"Nvidia Takes A Hit From China Probe, Falls Below Buy Point; Is Nvidia A Buy Or Sell Now?",,Yahoo,Nvidia took a hit early Monday after news of a fresh probe in China.  Nvidia stock fell 2% and below a buy point of 140.76 in the opening minutes of trading.  China's State Administration for Market Regulation is investigating whether Nvidia has violated its antimonopoly laws.,https://finnhub.io/api/news?id=0ce6cedb9188138c4ea5ed6e399a8929b1a615ef1fa43796b2a1498a1f87c7cd
